{
  "$schema": "https://json-schema.org/draft/2020-12/schema",
  "$id": "https://github.com/jpawlowski/hass.topology/schemas/store-v1.json",
  "title": "topology store v1",
  "type": "object",
  "required": ["schema_version", "home_config", "areas", "edges", "floors"],
  "additionalProperties": false,
  "properties": {
    "schema_version": { "const": 1 },
    "home_config": {
      "type": "object",
      "required": ["occupancy_extent", "projection_toggles", "imports_done_at", "unannotated_repair_threshold"],
      "additionalProperties": false,
      "properties": {
        "occupancy_extent": { "enum": ["whole_property", "unit_within_building"] },
        "unannotated_repair_threshold": {
          "type": "integer",
          "minimum": 1,
          "maximum": 100,
          "default": 3,
          "description": "Unannotated-area count at which the repair issue fires (ADR 'Registry-Driven State'; configurable per decision D10)"
        },
        "projection_toggles": {
          "type": "object",
          "required": ["environment", "type", "trust"],
          "additionalProperties": false,
          "properties": {
            "environment": { "type": "boolean" },
            "type": { "type": "boolean" },
            "trust": { "type": "boolean" }
          }
        },
        "imports_done_at": {
          "type": "object",
          "additionalProperties": false,
          "properties": {
            "aliases": { "type": ["string", "null"], "format": "date-time" },
            "labels": { "type": ["string", "null"], "format": "date-time" }
          }
        }
      }
    },
    "areas": {
      "type": "object",
      "description": "Keyed by HA area_id (registry key; obligation 3.1)",
      "additionalProperties": { "$ref": "#/$defs/area_annotation" }
    },
    "edges": {
      "type": "object",
      "description": "Keyed by edge_id (see 2.3 id rule)",
      "additionalProperties": { "$ref": "#/$defs/edge" }
    },
    "floors": {
      "type": "object",
      "description": "Keyed by HA floor_id; level completion where the registry has none (decision D1)",
      "additionalProperties": { "$ref": "#/$defs/floor_override" }
    }
  },
  "$defs": {
    "area_annotation": {
      "type": "object",
      "required": ["updated_at"],
      "additionalProperties": false,
      "properties": {
        "type": { "type": ["string", "null"] },
        "environment": { "enum": ["indoor", "outdoor", "semi_outdoor", null] },
        "trust": { "enum": ["private", "shared", "public", null] },
        "beyond": {
          "type": "object",
          "propertyNames": { "enum": ["N", "E", "S", "W"] },
          "additionalProperties": { "enum": ["outdoor", "neighbor", "earth"] }
        },
        "exterior_connections": {
          "type": "array",
          "description": "Connections facing outside the modeled home (window, outside door) attached to the one area (design 1; decision D2). inline_trust is legal only here.",
          "items": { "$ref": "#/$defs/connection" }
        },
        "updated_at": { "type": "string", "format": "date-time" },
        "orphaned_at": { "type": "string", "format": "date-time" }
      }
    },
    "floor_override": {
      "type": "object",
      "required": ["updated_at"],
      "additionalProperties": false,
      "properties": {
        "level_override": {
          "type": ["integer", "null"],
          "description": "Consulted ONLY while the registry floor's level is None (consume, then complement; never shadows a registry value)"
        },
        "updated_at": { "type": "string", "format": "date-time" },
        "orphaned_at": { "type": "string", "format": "date-time" }
      }
    },
    "edge": {
      "type": "object",
      "required": ["area_a", "area_b", "connections", "created_at"],
      "additionalProperties": false,
      "properties": {
        "area_a": { "type": "string" },
        "area_b": { "type": "string" },
        "connections": {
          "type": "array",
          "minItems": 1,
          "items": { "$ref": "#/$defs/connection" }
        },
        "created_at": { "type": "string", "format": "date-time" },
        "orphaned_at": { "type": "string", "format": "date-time" }
      }
    },
    "connection": {
      "type": "object",
      "required": ["passage", "barrier"],
      "additionalProperties": false,
      "properties": {
        "passage": { "enum": ["none", "level", "stairs", "ramp", "elevator", "ladder", "hatch"] },
        "barrier": { "enum": ["open", "door", "solid"] },
        "side": { "enum": ["N", "E", "S", "W"] },
        "sensor_entity_id": {
          "type": "string",
          "pattern": "^binary_sensor\\.[a-z0-9_]+$",
          "description": "Only valid when barrier == door"
        },
        "glazed": { "type": "boolean", "default": false },
        "preset_name": {
          "type": "string",
          "description": "UI provenance only; the two-axis form is authoritative (1)"
        },
        "perimeter_override": {
          "type": "boolean",
          "description": "Force perimeter membership for same-trust boundaries (1)"
        },
        "inline_trust": {
          "enum": ["private", "shared", "public"],
          "description": "exterior_connections only: trust class beyond an unmodeled target (design 1: 'may carry an inline class'). Absent => public. Rejected on interior edges."
        }
      }
    }
  }
}
