{
  "schema_version": 1,
  "home_config": {
    "occupancy_extent": "unit_within_building",
    "projection_toggles": { "environment": false, "type": false, "trust": false },
    "imports_done_at": { "aliases": null, "labels": null },
    "unannotated_repair_threshold": 3
  },
  "areas": {
    "flur": {
      "type": "hallway",
      "environment": "indoor",
      "trust": "private",
      "beyond": { "N": "neighbor" },
      "exterior_connections": [
        {
          "passage": "level",
          "barrier": "door",
          "side": "N",
          "sensor_entity_id": "binary_sensor.wohnungstuer_contact",
          "preset_name": "outside_door",
          "inline_trust": "shared"
        }
      ],
      "updated_at": "2026-07-23T10:00:00+00:00"
    },
    "wohnzimmer": {
      "type": "living",
      "environment": "indoor",
      "trust": "private",
      "beyond": { "S": "outdoor", "W": "outdoor" },
      "exterior_connections": [
        {
          "passage": "none",
          "barrier": "door",
          "side": "S",
          "glazed": true,
          "sensor_entity_id": "binary_sensor.wohnzimmer_fenster_contact",
          "preset_name": "window"
        }
      ],
      "updated_at": "2026-07-23T10:01:00+00:00"
    },
    "kueche": {
      "type": "kitchen",
      "environment": "indoor",
      "trust": "private",
      "beyond": { "S": "outdoor" },
      "exterior_connections": [
        {
          "passage": "none",
          "barrier": "door",
          "side": "S",
          "glazed": true,
          "preset_name": "window"
        }
      ],
      "updated_at": "2026-07-23T10:02:00+00:00"
    }
  },
  "edges": {
    "flur::wohnzimmer": {
      "area_a": "flur",
      "area_b": "wohnzimmer",
      "connections": [{ "passage": "level", "barrier": "door", "preset_name": "interior_door" }],
      "created_at": "2026-07-23T10:05:00+00:00"
    },
    "flur::kueche": {
      "area_a": "flur",
      "area_b": "kueche",
      "connections": [{ "passage": "level", "barrier": "door", "preset_name": "interior_door" }],
      "created_at": "2026-07-23T10:05:30+00:00"
    },
    "kueche::wohnzimmer": {
      "area_a": "kueche",
      "area_b": "wohnzimmer",
      "connections": [{ "passage": "level", "barrier": "open", "preset_name": "open_passage" }],
      "created_at": "2026-07-23T10:06:00+00:00"
    }
  },
  "floors": {
    "etage_3": {
      "level_override": 3,
      "updated_at": "2026-07-23T10:03:00+00:00"
    }
  }
}
